{
 "rule_id": "BR-SP-ENV-002",
 "pack_id": "brazil_new_energy",
 "version": "0.1.0",
 "title_zh": "重大环境影响项目须编制 EIA/RIMA",
 "title_pt": "Empreendimento de significativo impacto exige EIA/RIMA",
 "legal_sources": [
  {
   "citation_id": "urn:lex:br:conselho.nacional.meio.ambiente:resolucao:1986-01-23;1",
   "urn": "urn:lex:br:conselho.nacional.meio.ambiente:resolucao:1986-01-23;1",
   "article": "art. 2º",
   "label": "Resolução CONAMA 1/1986"
  },
  {
   "citation_id": "urn:lex:br:conselho.nacional.meio.ambiente:resolucao:1997-12-19;237",
   "urn": "urn:lex:br:conselho.nacional.meio.ambiente:resolucao:1997-12-19;237",
   "article": "art. 3º",
   "label": "Resolução CONAMA 237/1997"
  }
 ],
 "elements": [
  {
   "element_id": "significant_impact",
   "description_zh": "项目规模/类型落入须环评的目录或可能造成重大环境退化",
   "description_pt": "potencial de significativa degradação",
   "fact_fields": [
    "project_content_scale",
    "description"
   ]
  }
 ],
 "exceptions": [
  "经许可机关论证可采用简化环境研究（RAP 等）替代完整 EIA/RIMA 的情形"
 ],
 "consequences": [
  "缺失 EIA/RIMA 的许可可被司法或环保机关撤销；项目停滞与行政处罚"
 ],
 "red_flags": [
  {
   "flag_id": "RF-ENV-002a",
   "condition_zh": "大型产线/高排放项目材料中无任何环评安排",
   "severity": "high"
  }
 ],
 "certification_status": "provisional",
 "production_tracks": {
  "forward_done": true,
  "reverse_done": false,
  "divergence_types": []
 },
 "checklist_codes": [
  "ENV-001"
 ],
 "notes": "provisional：待巴西法律研究者核验（见 docs/recruitment/）。"
}